<ItemSupCtyDesc
	xmlns="http://www.oracle.com/retail/integration/base/bo/ItemSupCtyDesc/v1"
	xmlns:xsi="http://www.w3.org/2001/XMLSchema-instance" xsi:schemaLocation="http://www.oracle.com/retail/integration/base/bo/ItemSupCtyDesc/v1 http://www.oracle.com/retail/integration/base/bo/ItemSupCtyDesc/v1/ItemSupCtyDesc.xsd ">
	<item>sGoUAlCoEpRNoBUIVHrByæ±</item>
	<supplier>NyyZpeæ±</supplier>
	<origin_country_id>a</origin_country_id>
	<primary_supp_ind>a</primary_supp_ind>
	<primary_country_ind>a</primary_country_ind>
	<unit_cost>20.4</unit_cost>
	<lead_time>4</lead_time>
	<pickup_lead_time>4</pickup_lead_time>
	<supp_pack_size>12.4</supp_pack_size>
	<inner_pack_size>12.4</inner_pack_size>
	<round_lvl>Jhæ±</round_lvl>
	<min_order_qty>12.4</min_order_qty>
	<max_order_qty>12.4</max_order_qty>
	<packing_method>zMæ±</packing_method>
	<default_uop>Yyæ±</default_uop>
	<ti>12.4</ti>
	<hi>12.4</hi>
	<cost_uom>æ±</cost_uom>
	<tolerance_type>GHæ±</tolerance_type>
	<max_tolerance>12.4</max_tolerance>
	<min_tolerance>12.4</min_tolerance>
	<ns1:CustFlexAttriVo
		xmlns:ns1="http://www.oracle.com/retail/integration/base/bo/CustFlexAttriVo/v1">
		<ns1:name>vGdrcwVYUVfIxCPEhNSuLvZCRaæ±</ns1:name>
		<ns1:value>BkHKINNkNVsfrTRHzCDnzWpHXknTwiTFoyizemGDNLXxsZRRYQNnhspWGaguuaulWGyBWWZwPHwvCDUyAWzSZuSwRCqWLYwyiSTgqYQlaquYyeTdDMQRWIHfOZdPiCTLgpdGWjYJqLTRMgHToXchRhiABhpcwPnLOTQSsaMuUHqMneHYUUogvUQoMAAvfcyKMvaoHwGCahJcXHIpdXsbnBrSasuZxbMRNzQTNCamGJTyNkATmGrqWnæ±</ns1:value>
		<ns1:value_date>2013-09-01T09:08:07</ns1:value_date>
	</ns1:CustFlexAttriVo>
	<round_to_inner_pct>12.4</round_to_inner_pct>
	<round_to_case_pct>12.4</round_to_case_pct>
	<round_to_layer_pct>12.4</round_to_layer_pct>
	<round_to_pallet_pct>12.4</round_to_pallet_pct>
	<supp_hier_type_1>peæ±</supp_hier_type_1>
	<supp_hier_lvl_1>uXxAuIæ±</supp_hier_lvl_1>
	<supp_hier_type_2>SBæ±</supp_hier_type_2>
	<supp_hier_lvl_2>dfYZdNæ±</supp_hier_lvl_2>
	<supp_hier_type_3>mkæ±</supp_hier_type_3>
	<supp_hier_lvl_3>UkcbXFæ±</supp_hier_lvl_3>
	<negotiated_item_cost>20.4</negotiated_item_cost>
	<extended_base_cost>20.4</extended_base_cost>
	<inclusive_cost>20.4</inclusive_cost>
	<base_cost>20.4</base_cost>
	<purchase_type>a</purchase_type>
	<calculation_basis>a</calculation_basis>
	<purchase_rate>12.4</purchase_rate>
</ItemSupCtyDesc>